{
  "$schema": "https://json-schema.org/draft/2020-12/schema",
  "$id": "https://design-prototype-kit/spec-prototype/schemas/intent.v1.json",
  "title": "Stage 1 Intent Contract",
  "description": "Machine-readable Stage 1 intent tier. Authored directly as prototype/intent.json. Only fields the Stage 1 frontier owns appear here; Stage 3/4 state taxonomy is deliberately absent so an author cannot mistake a Stage 1 gate for a Stage 3/4 one.",
  "type": "object",
  "additionalProperties": false,
  "required": ["schema_version", "slice_id", "core_tension", "declared_surfaces", "physical_anchor"],
  "properties": {
    "schema_version": {
      "const": "intent.v1"
    },
    "slice_id": {
      "type": "string",
      "pattern": "^[A-Za-z0-9_-]+$",
      "description": "Bounded slice identifier; names the compiled artifact set."
    },
    "core_tension": {
      "type": "string",
      "minLength": 1,
      "description": "The authentic product tension, as `<A> vs <B>` or a full sentence."
    },
    "declared_surfaces": {
      "type": "array",
      "minItems": 1,
      "items": {
        "type": "string",
        "pattern": "^[A-Za-z0-9_/-]+$"
      },
      "description": "Surface identifiers this slice owns. The first entry is the primary surface."
    },
    "physical_anchor": {
      "type": "string",
      "minLength": 1,
      "description": "The real-world object or space whose physicality drives the spatial chassis, or `none` when the product has no device-shaped anchor. An empty value is not a declaration."
    },
    "five_axes": {
      "type": "object",
      "additionalProperties": false,
      "description": "Optional continuous calibration. An unset axis stays open; never filled with a default that would reach the builder as if it were authored.",
      "properties": {
        "density": {"type": "string"},
        "energy": {"type": "string"},
        "materiality": {"type": "string"},
        "rhythm": {"type": "string"},
        "character": {"type": "string"}
      }
    },
    "content_language": {
      "type": "string",
      "description": "Locked content language tag, for example `zh-Hans`."
    }
  }
}
