{
  "schema_version": "intent.v1",
  "slice_id": "sample-slice",
  "core_tension": "Operational throughput vs Irreversible drain risk",
  "declared_surfaces": ["cockpit-main", "detail-drawer"],
  "physical_anchor": "short-haul flight deck: two operator positions, instrument clusters in sightline sectors, two-hand commit controls",
  "content_language": "zh-Hans"
}
